Nome da ONG,Missão,Foco,Endereço,Telefone,Site,Latitude,Longitude
Associação Recifense de Defesa do Meio Ambiente (ARDMA),"Promover a conservação do meio ambiente em Recife através de ações de educação ambiental, pesquisa e advocacy.","Preservação dos manguezais, áreas costeiras e biodiversidade urbana.","Rua da Aurora, 123 - Boa Vista, Recife - PE",(81) 3333-3333,https://es.wiktionary.org/wiki/removido (fictício),-8.062222,-34.898333
Projeto Coral Vivo,"Proteger os recifes de coral de Recife através de pesquisas científicas, ações de restauração e educação ambiental.","Conservação da biodiversidade marinha, monitoramento da qualidade da água e engajamento da comunidade local.","Avenida Boa Viagem, 1000 - Pina, Recife - PE",(81) 4444-4444,https://coralvivo.org.br/quem-somos/ (fictício),-8.073333,-34.925
Instituto Recifense de Sustentabilidade (IRS),"Promover o desenvolvimento sustentável em Recife através de projetos de ecoeficiência, economia circular e educação ambiental.","Redução da geração de resíduos, reuso de materiais e consumo consciente.","Rua da Conceição, 500 - Santo Antônio, Recife - PE",(81) 5555-5555,https://es.wiktionary.org/wiki/removido (fictício),-8.058333,-34.883333
Coletivo Ecoar,"Fortalecer a participação da sociedade civil na defesa do meio ambiente em Recife através de ações de mobilização social, campanhas de conscientização e ativismo ambiental.","Combate à poluição, defesa de áreas verdes e promoção da justiça ambiental.","Rua do Sol, 200 - Várzea, Recife - PE",(81) 6666-6666,https://es.wiktionary.org/wiki/removido (fictício),-8.043333,-34.866667
ONG Maré Viva,"Promover a inclusão social e o empoderamento de comunidades costeiras em Recife através de projetos de educação ambiental, geração de renda e gestão ambiental participativa.","Coleta seletiva de resíduos, agricultura urbana e turismo sustentável.","Rua da Praia, 300 - Boa Viagem, Recife - PE",(81) 7777-7777,https://es.wiktionary.org/wiki/removido (fictício),-8.083333,-34.916667
